"Status","Start Time","Stop Time","Duration in ms","Parent Suite","Suite","Sub Suite","Test Class","Test Method","Name","Description"
"passed","Mon Aug 26 09:02:54 GMT 2024","Mon Aug 26 09:02:55 GMT 2024","1230","","Standard User","","com.github.eataborda.ui.features.StandardUserTest","orderInventoryItemsTest","Order inventory items test","Verification of the inventory order options"
"passed","Mon Aug 26 09:02:49 GMT 2024","Mon Aug 26 09:02:50 GMT 2024","974","","Problem User","","com.github.eataborda.ui.features.ProblemUserTest","inventoryItemsWithIssuesTest","Inventory items with src issues test","Verification of the visual error of the inventory using a problem user"
"passed","Mon Aug 26 09:02:45 GMT 2024","Mon Aug 26 09:02:46 GMT 2024","804","","Locked Out User","","com.github.eataborda.ui.features.LockedOutUserTest","wrongPasswordTest","Login wrong password test","Verification of the error messages for a correct user and wrong password"
"broken","Mon Aug 26 09:02:55 GMT 2024","Mon Aug 26 09:03:07 GMT 2024","11739","","Standard User","","com.github.eataborda.ui.features.StandardUserTest","buyItemsTest","Buy items test","A complete shopping flow"
"passed","Mon Aug 26 09:02:51 GMT 2024","Mon Aug 26 09:02:52 GMT 2024","1499","","Standard User","","com.github.eataborda.ui.features.StandardUserTest","verifyCheckoutUserDataTest","Verify checkout user data test","Verification of the user information before checkout"
"passed","Mon Aug 26 09:02:50 GMT 2024","Mon Aug 26 09:02:51 GMT 2024","1153","","Standard User","","com.github.eataborda.ui.features.StandardUserTest","cartItemsPersistenceTest","Cart items persistence test","Verification of the persistence of the items cart "
"passed","Mon Aug 26 09:02:46 GMT 2024","Mon Aug 26 09:02:49 GMT 2024","2582","","Problem User","","com.github.eataborda.ui.features.ProblemUserTest","inventoryFilterIssuesTest","Inventory filter issues test","Verification of the inventory filter issues"
"passed","Mon Aug 26 09:02:52 GMT 2024","Mon Aug 26 09:02:54 GMT 2024","1234","","Standard User","","com.github.eataborda.ui.features.StandardUserTest","removeCartItemsTest","Remove cart items test","Verification of the number of items into the cart "
"passed","Mon Aug 26 09:02:33 GMT 2024","Mon Aug 26 09:02:45 GMT 2024","12046","","Locked Out User","","com.github.eataborda.ui.features.LockedOutUserTest","lockedOutUserTest","Login locked out user test","Verification of the error messages for a blocked user"
