"Status","Start Time","Stop Time","Duration in ms","Parent Suite","Suite","Sub Suite","Test Class","Test Method","Name","Description"
"broken","Mon Sep 09 09:04:49 GMT 2024","Mon Sep 09 09:04:53 GMT 2024","3771","","Standard User","","com.github.eataborda.ui.features.StandardUserTest","buyItemsTest","Buy items test","A complete shopping flow"
"passed","Mon Sep 09 09:04:47 GMT 2024","Mon Sep 09 09:04:49 GMT 2024","2226","","Standard User","","com.github.eataborda.ui.features.StandardUserTest","orderInventoryItemsTest","Order inventory items test","Verification of the inventory order options"
"passed","Mon Sep 09 09:04:34 GMT 2024","Mon Sep 09 09:04:38 GMT 2024","3394","","Problem User","","com.github.eataborda.ui.features.ProblemUserTest","inventoryFilterIssuesTest","Inventory filter issues test","Verification of the inventory filter issues"
"passed","Mon Sep 09 09:04:33 GMT 2024","Mon Sep 09 09:04:34 GMT 2024","1139","","Locked Out User","","com.github.eataborda.ui.features.LockedOutUserTest","wrongPasswordTest","Login wrong password test","Verification of the error messages for a correct user and wrong password"
"passed","Mon Sep 09 09:04:39 GMT 2024","Mon Sep 09 09:04:41 GMT 2024","2261","","Standard User","","com.github.eataborda.ui.features.StandardUserTest","cartItemsPersistenceTest","Cart items persistence test","Verification of the persistence of the items cart "
"passed","Mon Sep 09 09:04:41 GMT 2024","Mon Sep 09 09:04:44 GMT 2024","2979","","Standard User","","com.github.eataborda.ui.features.StandardUserTest","verifyCheckoutUserDataTest","Verify checkout user data test","Verification of the user information before checkout"
"passed","Mon Sep 09 09:04:38 GMT 2024","Mon Sep 09 09:04:39 GMT 2024","1366","","Problem User","","com.github.eataborda.ui.features.ProblemUserTest","inventoryItemsWithIssuesTest","Inventory items with src issues test","Verification of the visual error of the inventory using a problem user"
"passed","Mon Sep 09 09:04:30 GMT 2024","Mon Sep 09 09:04:33 GMT 2024","2697","","Locked Out User","","com.github.eataborda.ui.features.LockedOutUserTest","lockedOutUserTest","Login locked out user test","Verification of the error messages for a blocked user"
"passed","Mon Sep 09 09:04:44 GMT 2024","Mon Sep 09 09:04:47 GMT 2024","2628","","Standard User","","com.github.eataborda.ui.features.StandardUserTest","removeCartItemsTest","Remove cart items test","Verification of the number of items into the cart "
