"Status","Start Time","Stop Time","Duration in ms","Parent Suite","Suite","Sub Suite","Test Class","Test Method","Name","Description"
"passed","Sat Aug 17 19:28:14 GMT 2024","Sat Aug 17 19:28:15 GMT 2024","1232","","Standard User","","com.github.eataborda.ui.features.StandardUserTest","orderInventoryItemsTest","Order inventory items test","Verification of the inventory order options"
"passed","Sat Aug 17 19:28:13 GMT 2024","Sat Aug 17 19:28:14 GMT 2024","1230","","Standard User","","com.github.eataborda.ui.features.StandardUserTest","removeCartItemsTest","Remove cart items test","Verification of the number of items into the cart "
"passed","Sat Aug 17 19:28:09 GMT 2024","Sat Aug 17 19:28:10 GMT 2024","947","","Problem User","","com.github.eataborda.ui.features.ProblemUserTest","inventoryItemsWithIssuesTest","Inventory items with src issues test","Verification of the visual error of the inventory using a problem user"
"passed","Sat Aug 17 19:28:15 GMT 2024","Sat Aug 17 19:28:17 GMT 2024","2043","","Standard User","","com.github.eataborda.ui.features.StandardUserTest","buyItemsTest","Buy items test","A complete shopping flow"
"passed","Sat Aug 17 19:28:11 GMT 2024","Sat Aug 17 19:28:13 GMT 2024","1527","","Standard User","","com.github.eataborda.ui.features.StandardUserTest","verifyCheckoutUserDataTest","Verify checkout user data test","Verification of the user information before checkout"
"passed","Sat Aug 17 19:28:06 GMT 2024","Sat Aug 17 19:28:09 GMT 2024","2681","","Problem User","","com.github.eataborda.ui.features.ProblemUserTest","inventoryFilterIssuesTest","Inventory filter issues test","Verification of the inventory filter issues"
"passed","Sat Aug 17 19:28:05 GMT 2024","Sat Aug 17 19:28:06 GMT 2024","815","","Locked Out User","","com.github.eataborda.ui.features.LockedOutUserTest","wrongPasswordTest","Login wrong password test","Verification of the error messages for a correct user and wrong password"
"passed","Sat Aug 17 19:27:54 GMT 2024","Sat Aug 17 19:28:05 GMT 2024","11783","","Locked Out User","","com.github.eataborda.ui.features.LockedOutUserTest","lockedOutUserTest","Login locked out user test","Verification of the error messages for a blocked user"
"passed","Sat Aug 17 19:28:10 GMT 2024","Sat Aug 17 19:28:11 GMT 2024","1153","","Standard User","","com.github.eataborda.ui.features.StandardUserTest","cartItemsPersistenceTest","Cart items persistence test","Verification of the persistence of the items cart "
